code,mets,major heading,specific activities,met
17310,6.8,walking,"walking, for exercise, with ski poles, Nordic walking, uphill",6.8
17320,6.0,walking,"walking, backwards, 3.5 mph, level",6.0
17325,8.0,walking,"walking, backwards, 3.5 mph, uphill, 5% grade",8.0
18010,2.5,water activities,"boating, power, driving",2.5
18012,1.3,water activities,"boating, power, passenger, light",1.3
18020,4.0,water activities,"canoeing, on camping trip (Taylor Code 270)",4.0
18025,3.3,water activities,"canoeing, harvesting wild rice, knocking rice off the stalks",3.3
18030,7.0,water activities,"canoeing, portaging",7.0
18040,2.8,water activities,"canoeing, rowing, 2.0-3.9 mph, light effort",2.8
18050,5.8,water activities,"canoeing, rowing, 4.0-5.9 mph, moderate effort",5.8
18060,12.5,water activities,"canoeing, rowing, kayaking, competition, >6 mph, vigorous effort",12.5
18070,3.5,water activities,"canoeing, rowing, for pleasure, general (Taylor Code 250)",3.5
18080,12.0,water activities,"canoeing, rowing, in competition, or crew or sculling (Taylor Code 260)",12.0
18090,3.0,water activities,"diving, springboard or platform",3.0
18100,5.0,water activities,"kayaking, moderate effort",5.0
18110,4.0,water activities,paddle boat,4.0
18120,3.0,water activities,"sailing, boat and board sailing, windsurfing, ice sailing, general (Taylor Code 235)",3.0
18130,4.5,water activities,"sailing, in competition",4.5
18140,3.3,water activities,"sailing, Sunfish/Laser/Hobby Cat, Keel boats, ocean sailing, yachting, leisure",3.3
18150,6.0,water activities,"skiing, water or wakeboarding (Taylor Code 220)",6.0
18160,7.0,water activities,"jet skiing, driving, in water",7.0
18180,15.8,water activities,"skindiving, fast",15.8
18190,11.8,water activities,"skindiving, moderate",11.8
18200,7.0,water activities,"skindiving, scuba diving, general (Taylor Code 310)",7.0
18210,5.0,water activities,snorkeling (Taylor Code 310),5.0
18220,3.0,water activities,"surfing, body or board, general",3.0
18222,5.0,water activities,"surfing, body or board, competitive",5.0
18225,6.0,water activities,"paddle boarding, standing",6.0
18230,9.8,water activities,"swimming laps, freestyle, fast, vigorous effort",9.8
18240,5.8,water activities,"swimming laps, freestyle, front crawl, slow, light or moderate effort",5.8
18250,9.5,water activities,"swimming, backstroke, general, training or competition",9.5
18255,4.8,water activities,"swimming, backstroke, recreational",4.8
18260,10.3,water activities,"swimming, breaststroke, general, training or competition",10.3
18265,5.3,water activities,"swimming, breaststroke, recreational",5.3
18270,13.8,water activities,"swimming, butterfly, general",13.8
18280,10.0,water activities,"swimming, crawl, fast speed, ~75 yards/minute, vigorous effort",10.0
18290,8.3,water activities,"swimming, crawl, medium speed, ~50 yards/minute, vigorous effort",8.3
18300,6.0,water activities,"swimming, lake, ocean, river (Taylor Codes 280, 295)",6.0
18310,6.0,water activities,"swimming, leisurely, not lap swimming, general",6.0
18320,7.0,water activities,"swimming, sidestroke, general",7.0
18330,8.0,water activities,"swimming, synchronized",8.0
18340,9.8,water activities,"swimming, treading water, fast, vigorous effort",9.8
18350,3.5,water activities,"swimming, treading water, moderate effort, general",3.5
18352,2.3,water activities,"tubing, floating on a river, general",2.3
18355,5.5,water activities,"water aerobics, water calisthenics",5.5
18360,10.0,water activities,water polo,10.0
18365,3.0,water activities,water volleyball,3.0
18366,9.8,water activities,water jogging,9.8
18367,2.5,water activities,"water walking, light effort, slow pace",2.5
18368,4.5,water activities,"water walking, moderate effort, moderate pace",4.5
18369,6.8,water activities,"water walking, vigorous effort, brisk pace",6.8
18370,5.0,water activities,"whitewater rafting, kayaking, or canoeing",5.0
18380,5.0,water activities,"windsurfing, not pumping for speed",5.0
18385,11.0,water activities,"windsurfing or kitesurfing, crossing trial",11.0
18390,13.5,water activities,"windsurfing, competition, pumping for speed",13.5
19005,7.5,winter activities,"dog sledding, mushing",7.5
19006,2.5,winter activities,"dog sledding, passenger",2.5
19010,6.0,winter activities,"moving ice house, set up/drill holes",6.0
19011,2.0,winter activities,"ice fishing, sitting",2.0
19018,14.0,winter activities,"skating, ice dancing",14.0
19020,5.5,winter activities,"skating, ice, 9 mph or less",5.5
19030,7.0,winter activities,"skating, ice, general (Taylor Code 360)",7.0
19040,9.0,winter activities,"skating, ice, rapidly, more than 9 mph, not competitive",9.0
19050,13.3,winter activities,"skating, speed, competitive",13.3
19060,7.0,winter activities,"ski jumping, climb up carrying skis",7.0
19075,7.0,winter activities,"skiing, general",7.0
19080,6.8,winter activities,"skiing, cross country, 2.5 mph, slow or light effort, ski walking",6.8
19090,9.0,winter activities,"skiing, cross country, 4.0-4.9 mph, moderate speed and effort, general",9.0
19100,12.5,winter activities,"skiing, cross country, 5.0-7.9 mph, brisk speed, vigorous effort",12.5
19110,15.0,winter activities,"skiing, cross country, >8.0 mph, elite skier, racing",15.0
19130,15.5,winter activities,"skiing, cross country, hard snow, uphill, maximum, snow mountaineering",15.5
19135,13.3,winter activities,"skiing, cross-country, skating",13.3
19140,13.5,winter activities,"skiing, cross-country, biathlon, skating technique",13.5
19150,4.3,winter activities,"skiing, downhill, alpine or snowboarding, light effort, active time only",4.3
19160,5.3,winter activities,"skiing, downhill, alpine or snowboarding, moderate effort, general, active time only",5.3
19170,8.0,winter activities,"skiing, downhill, vigorous effort, racing",8.0
19175,12.5,winter activities,"skiing, roller, elite racers",12.5
19180,7.0,winter activities,"sledding, tobogganing, bobsledding, luge (Taylor Code 370)",7.0
19190,5.3,winter activities,"snow shoeing, moderate effort",5.3
19192,10.0,winter activities,"snow shoeing, vigorous effort",10.0
19200,3.5,winter activities,"snowmobiling, driving, moderate",3.5
19202,2.0,winter activities,"snowmobiling, passenger",2.0
19252,5.3,winter activities,"snow shoveling, by hand, moderate effort",5.3
19254,7.5,winter activities,"snow shoveling, by hand, vigorous effort",7.5
19260,2.5,winter activities,"snow blower, walking and pushing",2.5
20000,1.3,religious activities,"sitting in church, in service, attending a ceremony, sitting quietly",1.3
20001,2.0,religious activities,"sitting, playing an instrument at church",2.0
20005,1.8,religious activities,"sitting in church, talking or singing, attending a ceremony, sitting, active participation",1.8
20010,1.3,religious activities,"sitting, reading religious materials at home",1.3
20015,1.3,religious activities,"standing quietly in church, attending a ceremony",1.3
20020,2.0,religious activities,"standing, singing in church, attending a ceremony, standing, active participation",2.0
20025,1.3,religious activities,"kneeling in church or at home, praying",1.3
20030,1.8,religious activities,"standing, talking in church",1.8
20035,2.0,religious activities,walking in church,2.0
20036,2.0,religious activities,"walking, less than 2.0 mph, very slow",2.0
20037,3.5,religious activities,"walking, 3.0 mph, moderate speed, not carrying anything",3.5
20038,4.3,religious activities,"walking, 3.5 mph, brisk speed, not carrying anything",4.3
20039,2.0,religious activities,"walk/stand combination for religious purposes, usher",2.0
20040,5.0,religious activities,"praise with dance or run, spiritual dancing in church",5.0
20045,2.5,religious activities,serving food at church,2.5
20046,2.0,religious activities,preparing food at church,2.0
20047,3.3,religious activities,"washing dishes, cleaning kitchen at church",3.3
20050,1.5,religious activities,eating at church,1.5
20055,2.0,religious activities,"eating/talking at church or standing eating, American Indian Feast days",2.0
20060,3.3,religious activities,cleaning church,3.3
20061,4.0,religious activities,general yard work at church,4.0
20065,3.5,religious activities,"standing, moderate effort (e.g., lifting heavy objects, assembling at fast rate)",3.5
20095,4.5,religious activities,"Standing, moderate-to-heavy effort, manual labor, lifting ? 50 lbs, heavy maintenance",4.5
20100,1.3,religious activities,"typing, electric, manual, or computer",1.3
21000,1.5,volunteer activities,"sitting, meeting, general, and/or with talking involved",1.5
21005,1.5,volunteer activities,"sitting, light office work, in general",1.5
21010,2.5,volunteer activities,"sitting, moderate work",2.5
21015,2.3,volunteer activities,"standing, light work (filing, talking, assembling)",2.3
21016,2.0,volunteer activities,"sitting, child care, only active periods",2.0
21017,3.0,volunteer activities,"standing, child care, only active periods",3.0
21018,3.5,volunteer activities,"walk/run play with children, moderate, only active periods",3.5
21019,5.8,volunteer activities,"walk/run play with children, vigorous, only active periods",5.8
21020,3.0,volunteer activities,"standing, light/moderate work (e.g., pack boxes, assemble/repair, set up chairs/furniture)",3.0
21025,3.5,volunteer activities,"standing, moderate (lifting 50 lbs., assembling at fast rate)",3.5
21030,4.5,volunteer activities,"standing, moderate/heavy work",4.5
21035,1.3,volunteer activities,"typing, electric, manual, or computer",1.3
21040,2.0,volunteer activities,"walking, less than 2.0 mph, very slow",2.0
21045,3.5,volunteer activities,"walking, 3.0 mph, moderate speed, not carrying anything",3.5
21050,4.3,volunteer activities,"walking, 3.5 mph, brisk speed, not carrying anything",4.3
21055,3.5,volunteer activities,"walking, 2.5 mph slowly and carrying objects less than 25 lbs",3.5
21060,4.5,volunteer activities,"walking, 3.0 mph moderately and carrying objects less than 25 lbs, pushing something",4.5
21065,4.8,volunteer activities,"walking, 3.5 mph, briskly and carrying objects less than 25 lbs",4.8
21070,3.0,volunteer activities,"walk/stand combination, for volunteer purposes",3.0
